{
  "Asia": {
    "South Korea": {
      "_ko": "대한민국",
      "Seoul": {
        "ko": "서울",
        "tags": [
          "시티라이프",
          "쇼핑",
          "문화"
        ],
        "themeWeights": {
          "시티라이프": 0.8,
          "쇼핑": 0.8,
          "문화": 0.8
        },
        "monthMultipliers": {
          "1": 1.05,
          "2": 1.05,
          "3": 1.0,
          "4": 0.85,
          "5": 0.85,
          "6": 1.0,
          "7": 1.05,
          "8": 1.05,
          "9": 0.85,
          "10": 0.85,
          "11": 1.0,
          "12": 1.0
        },
        "bestMonths": [
          5,
          9,
          10
        ],
        "avoidMonths": [
          1,
          2
        ],
        "seasons": [
          "spring",
          "summer",
          "fall"
        ],
        "durationHint": {
          "minNights": 2,
          "maxNights": 6
        },
        "tier": "mid",
        "basePopularity": 0.72,
        "costIndex": {
          "hotel": 1.0,
          "food": 1.0,
          "transport": 1.0
        }
      },
      "Busan": {
        "ko": "부산",
        "tags": [
          "해변",
          "미식",
          "야경"
        ],
        "themeWeights": {
          "해변": 0.8,
          "미식": 0.8,
          "야경": 0.8
        },
        "monthMultipliers": {
          "1": 1.05,
          "2": 1.05,
          "3": 1.0,
          "4": 0.85,
          "5": 0.85,
          "6": 1.0,
          "7": 1.05,
          "8": 1.05,
          "9": 0.85,
          "10": 0.85,
          "11": 1.0,
          "12": 1.0
        },
        "bestMonths": [
          5,
          9,
          10
        ],
        "avoidMonths": [
          1,
          2
        ],
        "seasons": [
          "spring",
          "summer",
          "fall"
        ],
        "durationHint": {
          "minNights": 2,
          "maxNights": 6
        },
        "tier": "mid",
        "basePopularity": 0.72,
        "costIndex": {
          "hotel": 1.0,
          "food": 1.0,
          "transport": 1.0
        }
      },
      "Jeju": {
        "ko": "제주",
        "tags": [
          "자연",
          "휴양",
          "트레킹"
        ],
        "themeWeights": {
          "자연": 0.8,
          "휴양": 0.8,
          "트레킹": 0.8
        },
        "monthMultipliers": {
          "1": 1.05,
          "2": 1.05,
          "3": 1.0,
          "4": 0.85,
          "5": 0.85,
          "6": 1.0,
          "7": 1.05,
          "8": 1.05,
          "9": 0.85,
          "10": 0.85,
          "11": 1.0,
          "12": 1.0
        },
        "bestMonths": [
          5,
          9,
          10
        ],
        "avoidMonths": [
          1,
          2
        ],
        "seasons": [
          "spring",
          "summer",
          "fall"
        ],
        "durationHint": {
          "minNights": 2,
          "maxNights": 6
        },
        "tier": "mid",
        "basePopularity": 0.72,
        "costIndex": {
          "hotel": 1.0,
          "food": 1.0,
          "transport": 1.0
        }
      }
    },
    "Japan": {
      "_ko": "일본",
      "Tokyo": {
        "ko": "도쿄",
        "tags": [
          "시티라이프",
          "쇼핑",
          "서브컬처"
        ],
        "themeWeights": {
          "시티라이프": 0.8,
          "쇼핑": 0.8,
          "서브컬처": 0.8
        },
        "monthMultipliers": {
          "1": 1.05,
          "2": 1.05,
          "3": 1.0,
          "4": 0.85,
          "5": 0.85,
          "6": 1.0,
          "7": 1.05,
          "8": 1.05,
          "9": 0.85,
          "10": 0.85,
          "11": 1.0,
          "12": 1.0
        },
        "bestMonths": [
          5,
          9,
          10
        ],
        "avoidMonths": [
          1,
          2
        ],
        "seasons": [
          "spring",
          "summer",
          "fall"
        ],
        "durationHint": {
          "minNights": 2,
          "maxNights": 6
        },
        "tier": "mid",
        "basePopularity": 0.72,
        "costIndex": {
          "hotel": 1.0,
          "food": 1.0,
          "transport": 1.0
        }
      },
      "Kyoto": {
        "ko": "교토",
        "tags": [
          "전통",
          "사찰",
          "산책"
        ],
        "themeWeights": {
          "전통": 0.8,
          "사찰": 0.8,
          "산책": 0.8
        },
        "monthMultipliers": {
          "1": 1.05,
          "2": 1.05,
          "3": 1.0,
          "4": 0.85,
          "5": 0.85,
          "6": 1.0,
          "7": 1.05,
          "8": 1.05,
          "9": 0.85,
          "10": 0.85,
          "11": 1.0,
          "12": 1.0
        },
        "bestMonths": [
          5,
          9,
          10
        ],
        "avoidMonths": [
          1,
          2
        ],
        "seasons": [
          "spring",
          "summer",
          "fall"
        ],
        "durationHint": {
          "minNights": 2,
          "maxNights": 6
        },
        "tier": "mid",
        "basePopularity": 0.72,
        "costIndex": {
          "hotel": 1.0,
          "food": 1.0,
          "transport": 1.0
        }
      },
      "Osaka": {
        "ko": "오사카",
        "tags": [
          "미식",
          "쇼핑",
          "야경"
        ],
        "themeWeights": {
          "미식": 0.8,
          "쇼핑": 0.8,
          "야경": 0.8
        },
        "monthMultipliers": {
          "1": 1.05,
          "2": 1.05,
          "3": 1.0,
          "4": 0.85,
          "5": 0.85,
          "6": 1.0,
          "7": 1.05,
          "8": 1.05,
          "9": 0.85,
          "10": 0.85,
          "11": 1.0,
          "12": 1.0
        },
        "bestMonths": [
          5,
          9,
          10
        ],
        "avoidMonths": [
          1,
          2
        ],
        "seasons": [
          "spring",
          "summer",
          "fall"
        ],
        "durationHint": {
          "minNights": 2,
          "maxNights": 6
        },
        "tier": "mid",
        "basePopularity": 0.72,
        "costIndex": {
          "hotel": 1.0,
          "food": 1.0,
          "transport": 1.0
        }
      }
    },
    "Thailand": {
      "_ko": "태국",
      "Bangkok": {
        "ko": "방콕",
        "tags": [
          "시장",
          "사원",
          "미식"
        ],
        "themeWeights": {
          "시장": 0.8,
          "사원": 0.8,
          "미식": 0.8
        },
        "monthMultipliers": {
          "1": 0.75,
          "2": 0.75,
          "3": 0.75,
          "4": 1.0,
          "5": 1.0,
          "6": 1.2,
          "7": 1.2,
          "8": 1.2,
          "9": 1.2,
          "10": 1.0,
          "11": 0.75,
          "12": 0.75
        },
        "bestMonths": [
          11,
          12,
          1,
          2,
          3
        ],
        "avoidMonths": [
          7,
          8,
          9
        ],
        "seasons": [
          "winter",
          "spring"
        ],
        "durationHint": {
          "minNights": 2,
          "maxNights": 6
        },
        "tier": "mid",
        "basePopularity": 0.72,
        "costIndex": {
          "hotel": 1.0,
          "food": 1.0,
          "transport": 1.0
        }
      },
      "Phuket": {
        "ko": "푸켓",
        "tags": [
          "해변",
          "휴양",
          "액티비티"
        ],
        "themeWeights": {
          "해변": 0.8,
          "휴양": 0.8,
          "액티비티": 0.8
        },
        "monthMultipliers": {
          "1": 0.75,
          "2": 0.75,
          "3": 0.75,
          "4": 1.0,
          "5": 1.0,
          "6": 1.2,
          "7": 1.2,
          "8": 1.2,
          "9": 1.2,
          "10": 1.0,
          "11": 0.75,
          "12": 0.75
        },
        "bestMonths": [
          11,
          12,
          1,
          2,
          3
        ],
        "avoidMonths": [
          7,
          8,
          9
        ],
        "seasons": [
          "winter",
          "spring"
        ],
        "durationHint": {
          "minNights": 2,
          "maxNights": 6
        },
        "tier": "mid",
        "basePopularity": 0.72,
        "costIndex": {
          "hotel": 1.0,
          "food": 1.0,
          "transport": 1.0
        }
      },
      "Chiang Mai": {
        "ko": "치앙마이",
        "tags": [
          "올드타운",
          "카페",
          "자연"
        ],
        "themeWeights": {
          "올드타운": 0.8,
          "카페": 0.8,
          "자연": 0.8
        },
        "monthMultipliers": {
          "1": 0.75,
          "2": 0.75,
          "3": 0.75,
          "4": 1.0,
          "5": 1.0,
          "6": 1.2,
          "7": 1.2,
          "8": 1.2,
          "9": 1.2,
          "10": 1.0,
          "11": 0.75,
          "12": 0.75
        },
        "bestMonths": [
          11,
          12,
          1,
          2,
          3
        ],
        "avoidMonths": [
          7,
          8,
          9
        ],
        "seasons": [
          "winter",
          "spring"
        ],
        "durationHint": {
          "minNights": 2,
          "maxNights": 6
        },
        "tier": "mid",
        "basePopularity": 0.72,
        "costIndex": {
          "hotel": 1.0,
          "food": 1.0,
          "transport": 1.0
        }
      }
    },
    "Vietnam": {
      "_ko": "베트남",
      "Hanoi": {
        "ko": "하노이",
        "tags": [
          "호안끼엠",
          "올드쿼터",
          "카페"
        ],
        "themeWeights": {
          "호안끼엠": 0.8,
          "올드쿼터": 0.8,
          "카페": 0.8
        },
        "monthMultipliers": {
          "1": 0.75,
          "2": 0.75,
          "3": 0.75,
          "4": 1.0,
          "5": 1.0,
          "6": 1.2,
          "7": 1.2,
          "8": 1.2,
          "9": 1.2,
          "10": 1.0,
          "11": 0.75,
          "12": 0.75
        },
        "bestMonths": [
          11,
          12,
          1,
          2,
          3
        ],
        "avoidMonths": [
          7,
          8,
          9
        ],
        "seasons": [
          "winter",
          "spring"
        ],
        "durationHint": {
          "minNights": 2,
          "maxNights": 6
        },